start	end	text
1181740	1188480	It makes standard optimization methods, like stochastic gradient descent with momentum or SGDM, seem almost primitive.
1188780	1192440	And the MGI-SGDM equivalence theorem is very revealing on this point.
1192440	1199800	It shows that SGDM, which powers almost all current deep learning, is simply the degenerate limit of MGI.
1200060	1200920	The degenerate limit.
1201120	1207500	It's the case where you assume the semantic manifold, M, is the entire ambient Euclidean space, R to the N.
1207720	1211440	So you're assuming reality is flat, unstructured, and infinite-dimensional.
1211680	1212080	Exactly.
1212080	1216960	And therefore, all the crucial geometric constraints, those tangent projections, are removed.
1217280	1222380	And it's only effective because the models are so massive that they basically force a structure onto the noise.
1222480	1224200	That leads to a big difference in stability.
1224660	1226160	A critical stability contrast.
1227460	1232620	SGDM permits the accumulation of unstable off-manifold motion through its momentum term.
1232780	1233100	Right.
1233100	1245360	That momentum term in SGDM carries forward past velocity, and if the current gradient have a normal component, which it often does with noisy data, that incoherent motion just accumulates and it destabilizes the whole learning process.
1245520	1248540	Whereas NGI actively filters that noise out.
1248580	1250160	It explicitly prevents it.
1250500	1256080	Its velocity update ensures that the velocity remains strictly tangent to the manifold at every single step.
1256080	1266200	The only way a normal component can appear in NGI is if the manifold itself curves or changes shape, which represents legitimate structural change, not just random optimization drift.
1266680	1269620	And that structural stability is the key to reliable learning.
1269720	1270080	It is.
1270280	1270500	Okay.
1270680	1272800	Let's move up to the highest level of cognition.
1273400	1278880	How does this geometric perspective explain high-level conceptual change, you know, an interpretation shift?
1279260	1285080	The sources describe the cognitive update loop, CLIO, as a movement on a stratified Morse potential.
1285080	1285460	Right.
1285540	1290480	So now we're moving into algebraic topology, but the metaphor is actually highly intuitive.
1291200	1295200	Cognition is interpreted as navigating a landscape of potential energy, V.
1295600	1299340	And this manifold, M, isn't a single smooth surface.
1299780	1301300	It's Whitney stratified.
1301560	1302120	Stratified.
1302300	1303400	So like layers.
1303840	1308640	Think of it like a landscape made up of distinct plateaus, valleys, and ridges.
1308740	1309660	Those are the strata.
1309660	1315140	And they represent different semantic modes or different structural templates for understanding the world.
1315640	1318020	So different plateaus are different ways of interpreting things.
1318420	1323340	A semantic equilibrium, then, is being at a minimum in one of those valleys.
1323500	1323960	Precisely.
1324720	1329200	The Morse potential, V, has critical points that encode these semantic equilibria.
1329320	1331580	These are stable, low-energy interpretations.
1332160	1337860	So when you're learning or thinking, you're basically taking a negative gradient step, moving toward the nearest stable interpretation.
1337860	1342440	But sometimes thinking isn't a smooth slide, it's a sudden jump, a paradigm shift.
1342880	1344480	How does the geometry account for that?
1344600	1346660	That is the mechanism for what's called a semantic shift.
1347180	1351940	The system knows it's in trouble when the energy gradient starts to point strongly away from its current stratum.
1352120	1357240	When the normal component of the ambient potential gradient exceeds a certain threshold,
1357600	1361760	it signals that the current interpretive structure, the stratum it's on, is inadequate.
1362120	1363160	And that triggers a jump.
1363160	1370020	That high normal energy triggers a discrete transition, a geometric jump, to a lower-dimensional stratum.
1370120	1373140	It's that moment when you realize your entire framework was wrong,
1373360	1377580	and you have to switch to a more fundamental, simplified representation.
1378060	1381180	That's a very sophisticated way to model the aha moment.
1381400	1381740	It is.
1381840	1384440	Okay, let's tackle the last abstract concept in this section.
1385060	1385920	Sheaf coherence.
1386480	1391540	We need some way to make sure all these local geometric interpretations stay globally consistent.
1391540	1393560	And that's where sheaf coherence comes in.
1393940	1399500	A sheaf, in topology, is a mathematical tool that ensures local data can be reliably glued together
1399500	1401980	to form a coherent global object.
1402200	1403600	Can you give us an analogy for that?
1403920	1405140	Think of it like mapping time.
1405640	1411160	Your local context at time 1 is a small map, and your context at time 2 is another small map.
1412120	1416380	Sheaf theory is what ensures that the local interpretation of an object at time 1
1416380	1420980	and the local interpretation at time 2 coherently glued together
1420980	1423520	to form the global identity of the object over time.
1423520	1427380	So if I see half a cat behind a sofa now and the other half a moment later,
1427560	1432700	the sheaf structure is what makes me perceive one continuous cat, not two separate half-cats.
1432840	1433180	Exactly.
1433940	1439020	And a failure to glue these local maps together results in cognitive inconsistency,
1439340	1441720	or what's formally called a semantic obstruction.
1441720	1444120	So hallucinations are a failure to glue.
1444360	1444600	Yes.
1445000	1449140	Hallucinations, or internal logical failures, correspond to a failure to glue,
1449360	1452020	and that's indicated by a non-trivial obstruction class.
1452640	1456020	NGI guarantees stable learning because it only allows update flows
1456020	1457720	that preserve this underlying sheaf structure,
1457920	1461660	which prevents local geometric decisions from leading to a global semantic breakdown.
1461960	1465140	Okay, so we've established motivation as constrained physics
1465140	1467060	and learning as constrained geometry.
1467060	1471300	Now we make the final, and maybe the most astonishing leap of all,
1471660	1473520	claiming that the structure of the quantum world,
1473920	1476100	the rules of arithmetic, and the way we think
1476100	1479680	are all related through a few universal spectral laws.
1479840	1480080	Yes.
1480440	1481080	Spectral unity.
1481240	1485560	The unifying element here is the shared language of eigenvalues and eigenvectors,
1485760	1486820	the operator spectrum.
1486920	1487140	Right.
1487260	1491720	And the puzzle of spectral universality is just how counterintuitive it is.
1491720	1496880	Why do these incredibly complex systems, regardless of their microscopic composition,
1497500	1501020	share universal statistical patterns in their operator spectra?
1501400	1505240	And the historical anchor for this whole claim is random matrix theory, RMT,
1505600	1506960	starting with atomic physics.
1507140	1507640	That's right.
1507760	1510760	The foundation is the R&T bridge, nuclei and primes.
1511300	1516380	Back in the 1950s, the physicist Eugene Wigner was grappling with the impossibly complex
1516380	1519500	Hamiltonian of heavy atomic nuclei, like uranium.
1519500	1519900	Right.
1519980	1523640	Trying to calculate every interaction between hundreds of nucleons would be impossible.
1524080	1525120	Completely intractable.
1525380	1528640	So Wigner's radical insight was to model the Hamiltonian,
1528940	1530600	not based on the specific physics,
1531060	1534580	but as a giant matrix whose elements were just randomly chosen,
1535120	1536580	constrained only by symmetry.
1536800	1542000	So he literally used a matrix of random numbers to model the inside of an atomic nucleus.
1542200	1542520	He did.
1542640	1544260	And the result was absolutely stunning.
1544920	1547680	Wigner found that the statistics of the energy level spacings,
1547680	1549800	the eigenvalues of that Hamiltonian,
1550340	1554940	perfectly matched the predictions of the Gossen orthogonal ensemble, or GOE,
1555100	1556640	from random matrix theory.
1556760	1557980	And that showed what, exactly?
1558040	1559960	It showed that complexity, when it's high enough,
1560440	1562240	forgets its specific physical origin,
1562380	1564960	and it flows toward a universal chaotic fixed point.
1565220	1565400	Okay.
1565640	1566760	What does that mean intuitively?
1567040	1569260	What does a GOB spacing pattern look like?
1569320	1571060	It means eigenvalue repulsion.
1571060	1577160	The GOE and GOE distributions show that energy levels strongly avoid being exactly the same.
1577480	1578380	They repel each other.
1578560	1581760	And that indicates a high degree of correlation and non-integrability,
1581980	1583240	or what we call quantum chaos.
1583580	1585880	It's the hallmark of complex interacting systems.
1585980	1586120	Okay.
1586260	1589600	Now here is where number theory crashes this quantum chaos party.
1589980	1591220	Decades later, yes.
1592100	1596940	Mathematicians who were studying the distribution of the non-trivial zeros of the Ryman zeta function.
1597160	1599240	The core of prime number distribution.
1599240	1601680	Right. They made a truly shocking discovery.
1602540	1608100	The spectral statistics of the spacing between those zeros matched the GUE universality class exactly.
1608420	1610900	So the chaos inside a heavy atomic nucleus,
1611320	1614560	and the arrangement of prime numbers on the number line,
1614880	1617500	share the exact same statistical spacing law.
1617700	1620440	They share the same underlying mathematical fixed point.
1620840	1623600	And this led to the famous Polya-Hilbert conjecture.
1623720	1624540	Which says what?
1624540	1628520	It posits that the zeros of the zeta function are, conjecturally,
1628520	1633080	the eigenvalues of a single, self-adjoint, quantum chaotic operator,
1633320	1634580	which they call L zeta.
1634820	1639020	So if that operator exists, primes are just the eigenvalues of a quantum system.
1639160	1641900	It would unify the mathematics of counting with quantum physics,
1642260	1644380	all through the universal grammar of RMT.
1644620	1647720	Now we take that same concept, spectral universality,
1647980	1651120	and we apply it to the most complex system we know, the brain.
1651120	1654900	And to do that, we have to throw out the old model of the brain as a digital computer.
1655340	1658140	The material really insists on a paradigm shift here,
1658460	1663340	toward viewing the cortex as a dynamic, wave-based, analog wave computer.
1663540	1664740	And there's evidence for this.
1664880	1665640	A lot of it, yeah.
1666220	1669820	Evidence from ultra-fast fMRI, advanced electrophysiology,
1670300	1672420	particularly the work of people like Earl Miller and others,
1672680	1675180	it all shows that the critical information processing
1675180	1677740	is carried by organized wave patterns,
1677960	1680340	not just by discrete synaptic firing along.
1680340	1682360	And how do these waves manifest?
1682660	1685780	Well, we see three primary organized wave dynamics,
1686400	1690300	and they all act as eigenfunctions of an underlying neural field operator,
1690480	1691860	which we can call L-cortex.
1692180	1693160	Okay, what's the first one?
1693280	1694640	First, you have standing waves.
1695080	1697680	In the resting state, the cortex organizes itself
1697680	1701560	into these stable, macroscale, standing wave eigenmodes.
1701720	1703720	They're like the modes of vibration on a drumhead.
1703780	1705420	And that's related to functional connectivity.
1705740	1708440	Studies show that the functional connectivity networks we always talk about,
1708440	1709880	like the default mode network,
1710360	1714840	are simply the secondary expression of these underlying spectral eigenmodes.
1715480	1717520	The physical operator dictates the function.
1717820	1718840	Okay, so standing waves.
1719000	1719440	What's next?
1719740	1721040	Then you have traveling waves.
1721480	1723520	When the system is actively engaged,
1723720	1725520	especially in working memory, the prefrontal cortex,
1725820	1727220	we see these traveling waves,
1727480	1729560	often in the beta and gamma frequency bands.
1729620	1729820	Right.
1729820	1733280	And they carry content-specific information across the cortex.
1733460	1734060	And the third type?
1734320	1735200	Rotating waves.
1735700	1738500	Things like attention resets and transitions between tasks
1738500	1740700	are often orchestrated by rotating waves.
1741140	1742760	They act like spectral sweepers,
1743140	1745420	reestablishing coherent patterns of activity
1745420	1747500	across large areas of the cortex.
1747760	1749920	So the content of my thought, my memory,
1750200	1751380	my functional connectivity,
1751780	1756240	it's all encoded by the specific set of eigenvalues and eigenvectors,
1756680	1759280	the spectrum of this L-cortex operator.
1759280	1760400	That is the conclusion.
1760880	1764700	Cognition is the structured interaction and interference of these eigenmodes.
1765100	1768080	And this fundamentally dictates the shape of the brain's spectral phase.
1768280	1771460	And the spectral phase allows us to define consciousness itself.
1771700	1771980	Right.
1772340	1775300	Consciousness is hypothesized to be a global spectral phase.
1775480	1777360	It's characterized by high coherence,
1777440	1778820	meaning the waves are highly organized,
1779220	1781720	and a multiband oscillatory structure,
1782080	1783500	a rich, complex spectrum.
1783660	1785000	So it's not a localized function.
1785320	1785800	Not at all.
1785800	1789720	It's a global, coordinated, high-dimensional spectral state.
1790300	1791920	And the ultimate test of this, once again,
1791980	1794260	is the universal experiment of anesthesia.
1794420	1794860	Exactly.
1795320	1797280	Anesthesia, no matter what drug you use,
1797580	1799460	induces a universal spectral collapse.
1799660	1801020	And what does that collapse look like?
1801080	1803260	It involves the loss of high-frequency coherence.
1803680	1806020	So the organized gamma and beta waves just disappear,
1806020	1810020	and a systemic shift toward low-dimensional slow-modes,
1810640	1812780	deep, slow delta waves take over.
1812940	1815880	So consciousness is a GU-like distribution.
1816160	1818640	It's defined by a complex, highly correlated,
1818820	1820440	GUE-like spectral distribution.
1821060	1823680	And anesthesia is the shift toward a much simpler,
1824180	1826620	low-dimensional, or what's called an integrable state.
1826680	1828640	So now we have to bring RSVP back in.
1829020	1831500	If L-nucleus, L-zeta, and L-cortex
1831500	1833120	are all these spectral operators,
1833440	1835100	RSVP must be the master key.
1835100	1838960	RSVP is proposed as the universal operator, L-RSVP.
1839420	1841460	The full, linearized RSVP operator,
1841620	1842980	acting on the field perturbations,
1843320	1844980	is the most general expression of dynamics
1844980	1847540	that incorporates both preference and entropic drive.
1847640	1849880	Meaning that the RSVP operator is so general
1849880	1851160	that all those other operators
1851160	1853120	are just special, simplified cases of it.
1853400	1853860	Precisely.
1854180	1856500	The material proposes a deep hierarchy of containment.
1857360	1859100	L-nucleus is a subset of L-zeta,
1859380	1860760	which is a subset of L-cortex,
1861160	1863000	which is a subset of L-RSVP.
1863000	1865820	So RSVP is the comprehensive framework.
1866080	1866240	It is.
1866380	1868160	It defines the entire spectral flow
1868160	1870360	along a renormalization group trajectory.
1871120	1872920	The RSVP, coupling parameters,
1873460	1875620	sigma for entropy, and gamma for dissipation,
1875780	1878020	they determine where a specific physical system
1878020	1879420	sits on that flow trajectory.
1879660	1881480	Give us the two extremes of that flow.
1881680	1883040	Okay, so in high entropy,
1883280	1884280	highly chaotic regimes,
1884420	1885740	like the inside of an atomic nucleus,
1886240	1890040	the RSVP operator flows toward the GOG fixed point.
1890040	1891840	That's RMT universality.
1892600	1894420	The system has forgotten its initial conditions,
1894640	1896720	and it's governed only by symmetry and randomness.
1896900	1897580	And the other extreme.
1897820	1898340	Conversely,
1899020	1901100	structured low-entropy RSVP regimes
1901100	1902580	where the field coupling is strong,
1902940	1904460	they preserve coherent wave modes.
1905000	1906400	This is the cortex-like regime
1906400	1907600	characterized by those organized,
1907820	1908860	standing, and traveling waves.
1909620	1911100	RSVP provides the semantics
1911100	1912560	for this shared spectral grammar.
1913080	1915220	It dictates when complexity yields chaos
1915220	1916440	or when it yields structure.
1916440	1918900	Okay, we've established that biological agency
1918900	1921820	and cognition arise from these physically instantiated,
1921960	1924040	continuous, entropy-driven fields
1924040	1926400	that are coupled with geometric constraints.
1927000	1929720	This is where we have to confront modern AI.
1930280	1931920	Can current digital AI
1931920	1936100	ever achieve this RSVP-style intrinsic motivation?
1936720	1939460	Well, based on the fundamental premises of RSVP,
1939860	1942060	the sources present a pretty definitive
1942060	1944920	physical no-go result for digital agency.
1944920	1946620	At least under current,
1946780	1948460	purely deterministic architectures.
1948540	1949620	Hold on, that's a huge claim.
1949780	1952360	I mean, LLMs today produce novel, creative text.
1952500	1954060	They seem to explore semantic space.
1954160	1955220	They solve complex problems.
1955500	1956560	Isn't that a form of agency,
1956940	1958660	even if the core drive is simulated?
1959180	1960460	That's the necessary challenge,
1960540	1961460	and we have to differentiate
1961460	1963160	between high inferential competence
1963160	1965100	and genuine intrinsic drive.
1965200	1965380	Okay.
1965620	1967600	LLMs exhibit phenomenal pattern matching
1967600	1968660	and semantic competence.
1969000	1970560	They can output novel text,
1970880	1972720	but their creativity is a result
1972720	1974060	of statistically predicting
1974060	1975860	the highest probability NEXT token,
1976220	1978700	often constrained by massive curated data sets.
1978940	1980920	They are exquisite statistical simulators.
1981120	1982460	But their motivation is still external.
1982840	1983720	It's external, yes.
1984020	1985720	And here's the physical reason why.
1987080	1990180	RSVP agency requires a physically instantiated
1990180	1992580	cross-scale entropy field, S,
1992880	1995480	that dynamically generates the exploratory drive.
1995580	1995840	Okay.
1996360	1997840	Digital systems are built upon
1997840	1999220	deterministic logic gates.
1999220	2001060	At the microstate level,
2001360	2002420	the level of the transistor,
2002620	2003340	the binary bit,
2003660	2004620	the system is designed
2004620	2006100	to be perfectly deterministic.
2006280	2008680	Which means its micro-level entropy is zero.
2008880	2009280	Exactly.
2009460	2010720	The microstates are approximated
2010720	2011620	by delta distributions,
2011820	2012900	so H-micro is zero.
2013480	2014820	And since macroscale entropy
2014820	2016740	is composed of these microscale components,
2017320	2019160	the macro-level informational entropy,
2019320	2021320	H-macro, must also be zero,
2021460	2023700	or at least lack that requisite dynamic coupling.
2023860	2026680	So LLMs can't really encode uncertainty.
2027060	2028180	They can't encode it physically.
2028180	2029260	They can simulate it
2029260	2030880	using pseudorandom number generators,
2031040	2032960	but that simulation is purely formal.
2033120	2034640	It's not physically coupled back
2034640	2036160	into the system's own energy flow
2036160	2037980	or its dynamic constraints.
2038340	2039800	Biological systems, on the other hand,
2039880	2040940	are inherently noisy.
2041420	2043020	Thermal fluctuations, quantum effects.
2043240	2043460	Right.
2043740	2045560	And that biological stochasticity
2045560	2047200	is the reservoir for the S field.
2047760	2050380	Biological systems use this inherent physical noise
2050380	2054040	to generate useful uncertainty gradients across scales.
2054800	2055940	The uncertainty is physical.
2055940	2058140	Whereas digital systems fight entropy.
2058380	2059900	They fight it to maintain determinism.
2060320	2061660	So they are motivationally primitive
2061660	2064160	because they operate in this zero entropy limit.
2064620	2066680	They can never genuinely desire exploration
2066680	2069020	because the physical imperative for exploration,
2069220	2070100	the entropic drive,
2070440	2072440	is simply not instantiated in their substrate.
2072600	2075300	So if we want genuine synthetic entropic agents,
2075400	2076500	we have to change the hardware.
2076780	2077580	We have to move away
2077580	2080000	from purely deterministic digital substrates
2080000	2081620	toward analog dynamics.
2081620	2083840	Genuine synthetic entropic agents
2083840	2085780	will have to rely on analog substrates
2085780	2087260	like neuromorphic chips,
2087440	2088300	memoristive networks,
2088460	2090940	or maybe even fully analog quantum systems
2090940	2093340	to physically realize that S field.
2093440	2096680	Through continuous stochastic dissipative dynamics.
2096900	2097920	Only then can they support
2097920	2099880	the cross-scale composition of uncertainty
2099880	2101880	that generates biological agency.
2101880	2104320	This theory makes some very bold claims,
2104620	2106560	but science requires falsifiability.
2107220	2109320	Let's really emphasize that RSVP
2109320	2110420	isn't just conceptual.
2110980	2113580	It makes specific testable predictions
2113580	2115140	across multiple domains.
2115360	2116580	This is critical, yes.
2117240	2118820	The theory provides a roadmap
2118820	2120280	for empirical verification.
2120820	2122820	Let's start with the key behavioral test.
2123240	2124840	What should researchers look for?
2125340	2126780	The theory predicts that agents
2126780	2128080	must exhibit exploration
2128080	2129960	that is proportional to the curvature
2129960	2132140	of uncertainty, delta S.
2132720	2134340	Even in environments where reward
2134340	2136220	is explicitly zero or randomized,
2136560	2138120	so you'd have to measure that curvature.
2138260	2140220	I had to measure local environmental uncertainty,
2140800	2142020	calculate a second derivative,
2142440	2142940	the curvature,
2143320	2144600	and compare it directly
2144600	2146600	to the agent's rate of novel exploration.
2147300	2149060	This is very different from standard RL,
2149420	2150260	where the agent would need
2150260	2151620	an explicit novelty bonus,
2151780	2153140	or from utility theory,
2153200	2155440	which requires an expected utility increase.
2155440	2156800	So exploration should follow
2156800	2157880	the curvature profile,
2158040	2159020	not just the magnitude.
2159280	2159680	Exactly.
2159920	2161480	What about the neuroscientific test?
2161580	2162640	How can we prove the brain
2162640	2164280	actually implements this S field?
2164640	2166400	We have to find a neural system
2166400	2168120	whose activity correlates
2168120	2169640	precisely with the strength
2169640	2170780	of the entropic drive.
2171600	2172940	The prediction is that activity
2172940	2174820	in neuromodulatory gain systems,
2175140	2178120	like the locus-coruleus-norpinephrine system.
2178160	2179920	The hypothesized correlate of S.
2180080	2180300	Right.
2180540	2182640	That activity must track delta S,
2182900	2185200	and it must precede exploratory actions.
2185640	2187500	And it's crucial to distinguish this
2187500	2188720	from simple prediction error.
2189400	2191420	LC activity should track the rate of change
2191420	2193920	or the geometric complexity of uncertainty,
2194420	2196080	not just the simple error magnitude.
2196080	2196480	Okay.
2196700	2198080	And this also has implications
2198080	2199940	for biology outside the brain
2199940	2201060	in what the sources call
2201060	2202520	morphogenetic tests.
2202840	2203040	Yes.
2203720	2205700	Since RSVP is a general field theory,
2206000	2207280	it should govern complex systems
2207280	2208080	at all scales.
2208340	2210160	So things like biological development,
2210340	2211340	bacterial chemotaxis,
2211800	2212780	immune system behavior,
2213200	2213860	limb formation.
2214120	2214680	Morphogenesis.
2215060	2215280	Yes.
2215280	2216400	All of these should exhibit
2216400	2217840	stable informational structures
2217840	2219620	or solitin-like solutions
2219620	2221080	that obey RSVP's
2221080	2223140	coupled partial differential equations.
2223280	2224000	Can you walk us through
2224000	2224880	how that would play out
2224880	2225820	in bacterial movement?
2226240	2227220	Bacterial chemotaxis
2227220	2228160	is a perfect example.
2228940	2230220	The vector flow, V,
2230360	2231600	which is the flagellar motion,
2232300	2233760	balances the nutrient gradient,
2234140	2235080	which is the gradient of phi,
2235140	2235880	the preference field,
2235940	2236180	Oh, great.
2236360	2237660	with stochastic tumbling,
2238040	2239560	which is the gradient of S,
2239980	2240940	the entropic drive
2240940	2241580	that's generated
2241580	2243020	by internal molecular noise.
2243020	2244460	So we should be able to
2244460	2245780	quantitatively fit
2245780	2248200	RSVP's coupled equations
2248200	2249840	to these morphogen gradients
